{
  "id": "example-google-sheets",
  "name": "Example Google Sheets route",
  "capability": "spreadsheet-read-write",
  "provider": "unselected",
  "native_type": "domain_adapter",
  "account_owner": "principal-selected-during-private-onboarding",
  "data_boundary": "named account spreadsheet and range",
  "config_reference": null,
  "credential_reference": "",
  "credential_status": "missing",
  "auth_method": "oauth",
  "requested_scopes": ["exact scopes selected during onboarding"],
  "capability_status": "Optional",
  "enabled": false,
  "outcome": "Read and update one approved range without affecting other cells",
  "evidence_definition": "Exact spreadsheet range and value readback plus idempotency and revoke proof",
  "official_documentation": [{"authority_id": "google-docs", "source": "https://developers.google.com/sheets/api", "retrieved_at": "2026-09-05T00:00:00Z"}],
  "candidate_review": {
    "source": "https://github.com/googleapis/google-api-python-client/tree/4dc2aeca2633476d3d497f2a4368ef91172b378e",
    "source_authority_id": "google-source",
    "version": "commit:4dc2aeca2633476d3d497f2a4368ef91172b378e",
    "license": "Apache-2.0",
    "dependencies": ["google-api-python-client==2.1.0"],
    "permissions": ["range read", "separately approved scoped write"],
    "data_categories": ["synthetic spreadsheet values until separate live approval"],
    "data_policy": "https://developers.google.com/terms/api-services-user-data-policy",
    "data_policy_authority_id": "google-data-policy",
    "cost_evidence": "https://developers.google.com/sheets/api/limits",
    "cost_evidence_authority_id": "google-cost"
  },
  "routes_compared": ["native", "reviewed skill", "direct API", "Composio", "do-not-enable"],
  "selection_approval": "not selected",
  "immutable_source": "sha256:acedbb1be8abdeb95b1054146d509833c35848ed63e8e9c7a219252c0d81f175",
  "synthetic_proof": {"result": "pass", "synthetic": true, "evidence": "tests/test_integration_contracts.py fake adapter"},
  "live_proof": null,
  "approved_operations": [],
  "prohibited_operations": ["live read", "live write", "broad spreadsheet mutation"],
  "priority": 1,
  "fallback_order": null,
  "cost_model": null,
  "budget_limit": null,
  "rate_limits": null,
  "retry_policy": {"attempts": 0, "idempotency_required_for_writes": true},
  "retention_days": null,
  "last_contract_test": null,
  "health": "unknown",
  "lifecycle": "disabled",
  "owner": "principal",
  "source": "blueprint example",
  "evidence": "synthetic contract only; no provider account",
  "fallback": "Use an approved export or do not enable",
  "disable_path": "Keep adapter disabled and revoke authorization if later granted",
  "rollback_path": "Reconcile unknown effects, restore prior pinned configuration, and confirm denial",
  "reusable_capture": {"reviewed": true, "private_data_removed": true}
}
